<?xml version="1.0" encoding="UTF-8"?>
<tns:lwiConfiguration xmlns:tns="http://telekom.hu/LwiConfiguration" xmlns:xsi="http://www.w3.org/2001/XMLSchema-instance" xsi:schemaLocation="http://telekom.hu/LwiConfiguration LwiConfiguration.xsd ">
  <tns:log>
    <tns:detail>FULL</tns:detail>
  </tns:log>
  <tns:consumers>
    <tns:consumerApplication>
      <tns:name>mami</tns:name>
      <tns:password>12345</tns:password>
    </tns:consumerApplication>
  </tns:consumers>
  <tns:providers>
    <tns:provider>
      <tns:name>cnr</tns:name>
      <tns:loadBalancerHost>shark-dev</tns:loadBalancerHost>
      <tns:loadBalancerPort>17001</tns:loadBalancerPort>
      <tns:protocol>https</tns:protocol>
      <tns:services>
        <tns:service>
          <tns:name>getMsisdn</tns:name>
          <tns:businessService>cnrservice/getmsidn</tns:businessService>
          <tns:validationType>CTX</tns:validationType>
          <tns:maxRequests>20</tns:maxRequests>
          <tns:requestQueueLength>40</tns:requestQueueLength>
          <tns:allowedConsumers/>
        </tns:service>
      </tns:services>
    </tns:provider>
  </tns:providers>
</tns:lwiConfiguration>
