<?xml version="1.0" encoding="UTF-8"?>
<tns:lwiConfiguration xmlns:tns="http://telekom.hu/LwiConfiguration" xmlns:xsi="http://www.w3.org/2001/XMLSchema-instance" xsi:schemaLocation="http://telekom.hu/LwiConfiguration LwiConfiguration.xsd ">
  <tns:log>
    <tns:detail>FULL</tns:detail>
  </tns:log>
  <tns:consumers>
    <tns:consumerApplication>
      <tns:name>tns:name</tns:name>
    </tns:consumerApplication>
  </tns:consumers>
  <tns:providers>
    <tns:provider>
      <tns:name>tns:name</tns:name>
      <tns:loadBalancerHost>tns:loadBalancerHost</tns:loadBalancerHost>
      <tns:loadBalancerPort>0</tns:loadBalancerPort>
      <tns:protocol>http</tns:protocol>
      <tns:services/>
    </tns:provider>
  </tns:providers>
</tns:lwiConfiguration>
